{
  "version": "1.0",
  "standard": "https://agentstxt.dev",
  "site": {
    "name": "agents.txt Standard",
    "url": "https://agentstxt.dev",
    "description": "The open specification for AI agent capability declarations. Layer 4 of the agent-readiness stack."
  },
  "authorization": {
    "protocols": [
      "agent-auth"
    ],
    "discovery": "/.well-known/agent-configuration"
  },
  "mcp": [
    {
      "url": "https://agentstxt.dev/mcp",
      "type": "streamable-http",
      "description": "Exposes the agents.txt spec as structured resources: sections, directive reference, examples, and the JSON schema for agents.json."
    }
  ],
  "skills": [
    {
      "url": "https://agentstxt.dev/skills/adopt-agents-txt/SKILL.md",
      "description": "Guides a developer through adopting the agents.txt standard on their own website: walks the spec, picks an adoption path (hand-write, generator, or library), and validates the result."
    }
  ],
  "a2a": [
    {
      "url": "https://agentstxt.dev/.well-known/agent-card.json",
      "description": "Reference A2A AgentCard describing a meta-agent that explains the agents.txt spec, validates discovery files, and points clients at the live MCP tools."
    }
  ]
}
